<?xml version="1.0" encoding="UTF-8"?>
<de:design xsi:schemaLocation="http://jbei.org/device_editor design.xsd" xmlns:de="http://jbei.org/device_editor" xmlns:xsi="http://www.w3.org/2001/XMLSchema-instance">
  <de:version>4.0</de:version>
  <de:sequenceFiles>
    <de:sequenceFile hash="8f1cbefb1143aa8de5e2a2044acc1fca7cd6135a9b3b6e29ffbf5eae2368cc60">
      <de:format>Genbank</de:format>
      <de:content><![CDATA[LOCUS       TN7R                     265 bp ds-DNA     linear       31-JUL-2012
ACCESSION   TN7R
VERSION     TN7R
KEYWORDS    .
FEATURES             Location/Qualifiers
     misc_feature    21..245
                     /label="Tn7R"
ORIGIN      
        1 ggatgccctg cgtaagcggg tgtgggcgga caataaagtc ttaaactgaa caaaatagat
       61 ctaaactatg acaataaagt cttaaactag acagaatagt tgtaaactga aatcagtcca
      121 gttatgctgt gaaaaagcat actggacttt tgttatggct aaagcaaact cttcattttc
      181 tgaagtgcaa attgcccgtc gtattaaaga ggggcgtggc caagggcatg gtaaagacta
      241 tattcgcggc gttgtgacaa tttac   
//
]]></de:content>
      <de:fileName>TN7R.gbk</de:fileName>
    </de:sequenceFile>
    <de:sequenceFile hash="e0e57544c327251e487207f9c69f0f848f2999760430507eab09796d40f7e93c">
      <de:format>Genbank</de:format>
      <de:content><![CDATA[LOCUS       GentR                    761 bp ds-DNA     linear       31-JUL-2012
ACCESSION   GentR
VERSION     GentR
KEYWORDS    .
FEATURES             Location/Qualifiers
     misc_feature    207..740
                     /label="Gentamycin R"
ORIGIN      
        1 ctgttcggtt cgtaaactgt aatgcaagta gcgtatgcgc tcacgcaact ggtccagaac
       61 cttgaccgaa cgcagcggtg gtaacggcgc agtggcggtt ttcatggctt gttatgactg
      121 tttttttgta cagtctatgc ctcgggcatc caagcagcaa gcgcgttacg ccgtgggtcg
      181 atgtttgatg ttatggagca gcaacgatgt tacgcagcag caacgatgtt acgcagcagg
      241 gcagtcgccc taaaacaaag ttaggtggct caagtatggg catcattcgc acatgtaggc
      301 tcggccctga ccaagtcaaa tccatgcggg ctgctcttga tcttttcggt cgtgagttcg
      361 gagacgtagc cacctactcc caacatcagc cggactccga ttacctcggg aacttgctcc
      421 gtagtaagac attcatcgcg cttgctgcct tcgaccaaga agcggttgtt ggcgctctcg
      481 cggcttacgt tctgcccaag tttgagcagc cgcgtagtga gatctatatc tatgatctcg
      541 cagtctccgg cgagcaccgg aggcagggca ttgccaccgc gctcatcaat ctcctcaagc
      601 atgaggccaa cgcgcttggt gcttatgtga tctacgtgca agcagattac ggtgacgatc
      661 ccgcagtggc tctctataca aagttgggca tacgggaaga agtgatgcac tttgatatcg
      721 acccaagtac cgccacctaa caattcgttc aagccgagat c 
//
]]></de:content>
      <de:fileName>GentR-Casette.gbk</de:fileName>
    </de:sequenceFile>
  </de:sequenceFiles>
  <de:partVOs>
    <de:partVO id="1343751993895362">
      <de:name>t</de:name>
      <de:revComp>false</de:revComp>
      <de:startBP>1</de:startBP>
      <de:stopBP>265</de:stopBP>
      <de:sequenceFileHash>8f1cbefb1143aa8de5e2a2044acc1fca7cd6135a9b3b6e29ffbf5eae2368cc60</de:sequenceFileHash>
      <de:parts>
        <de:part id="1343751993895462">
          <de:fas/>
        </de:part>
      </de:parts>
    </de:partVO>
    <de:partVO id="1343751993895876">
      <de:name>r</de:name>
      <de:revComp>false</de:revComp>
      <de:startBP>1</de:startBP>
      <de:stopBP>761</de:stopBP>
      <de:sequenceFileHash>e0e57544c327251e487207f9c69f0f848f2999760430507eab09796d40f7e93c</de:sequenceFileHash>
      <de:parts>
        <de:part id="1343751993899199">
          <de:fas/>
        </de:part>
      </de:parts>
    </de:partVO>
  </de:partVOs>
  <de:eugeneRules/>
  <de:j5Collection>
    <de:isCircular>true</de:isCircular>
    <de:j5Bins>
      <de:j5Bin>
        <de:binName>0</de:binName>
        <de:iconID>generic</de:iconID>
        <de:direction>forward</de:direction>
        <de:dsf>false</de:dsf>
        <de:binItems>
          <de:partID>1343751993895462</de:partID>
        </de:binItems>
      </de:j5Bin>
      <de:j5Bin>
        <de:binName>1</de:binName>
        <de:iconID>generic</de:iconID>
        <de:direction>forward</de:direction>
        <de:dsf>false</de:dsf>
        <de:binItems>
          <de:partID>1343751993899199</de:partID>
        </de:binItems>
      </de:j5Bin>
    </de:j5Bins>
  </de:j5Collection>
</de:design>