<?xml version="1.0" encoding="UTF-8"?>
<de:design xsi:schemaLocation="http://jbei.org/device_editor design.xsd" xmlns:de="http://jbei.org/device_editor" xmlns:xsi="http://www.w3.org/2001/XMLSchema-instance">
  <de:version>4.0</de:version>
  <de:sequenceFiles/>
  <de:partVOs/>
  <de:eugeneRules/>
  <de:j5Collection>
    <de:isCircular>true</de:isCircular>
    <de:j5Bins>
      <de:j5Bin>
        <de:binName>No_Name0</de:binName>
        <de:iconID>promoter</de:iconID>
        <de:direction>forward</de:direction>
        <de:dsf>false</de:dsf>
        <de:binItems/>
      </de:j5Bin>
    </de:j5Bins>
  </de:j5Collection>
</de:design>